<?xml version="1.0" encoding="UTF-8"?>
<!DOCTYPE college SYSTEM "college_management.dtd">
<!-- <?xml-stylesheet href="college.xsl" type=text/xsl> -->
<college xmlns:xsi="http://www.w3.org/2001/XMLSchema-instance"
         xsi:noNamespaceSchemaLocation="college.xsd">
    <!-- Information about departments -->
    <departments>
        <department>
            <DeptCode>CS</DeptCode>
            <DeptName>Computer Science</DeptName>
            <HOD>John Daniel</HOD>
            <OfficeLocation>Building A, Room 101</OfficeLocation>
            <Ph_no>555-6789</Ph_no>
            <Email>cs.dept@example.com</Email>
        </department>
        <department>
            <DeptCode>BA</DeptCode>
            <DeptName>Business Administration</DeptName>
            <HOD>Jacob Zakaria</HOD>
            <OfficeLocation>Building B, Room 202</OfficeLocation>
            <Ph_no>555-6790</Ph_no>
            <Email>ba.dept@example.com</Email>
        </department>
        <department>
            <DeptCode>ME</DeptCode>
            <DeptName>Mechanical Engineering</DeptName>
            <HOD>Michael Roy</HOD>
            <OfficeLocation>Building C, Room 303</OfficeLocation>
            <Ph_no>555-6791</Ph_no>
            <Email>me.dept@example.com</Email>
        </department>
        <department>
            <DeptCode>EE</DeptCode>
            <DeptName>Electrical Engineering</DeptName>
            <HOD>Susan George</HOD>
            <OfficeLocation>Building D, Room 404</OfficeLocation>
            <Ph_no>555-6792</Ph_no>
            <Email>ee.dept@example.com</Email>
        </department>
        <department>
            <DeptCode>CE</DeptCode>
            <DeptName>Civil Engineering</DeptName>
            <HOD>Patricia Brooks</HOD>
            <OfficeLocation>Building E, Room 505</OfficeLocation>
            <Ph_no>555-6793</Ph_no>
            <Email>ce.dept@example.com</Email>
        </department>
        <department>
            <DeptCode>CH</DeptCode>
            <DeptName>Chemical Engineering</DeptName>
            <HOD>David Clark</HOD>
            <OfficeLocation>Building F, Room 606</OfficeLocation>
            <Ph_no>555-6794</Ph_no>
            <Email>ch.dept@example.com</Email>
        </department>
        <department>
            <DeptCode>MT</DeptCode>
            <DeptName>Mathematics</DeptName>
            <HOD>Linda Miller</HOD>
            <OfficeLocation>Building G, Room 707</OfficeLocation>
            <Ph_no>555-6795</Ph_no>
            <Email>mt.dept@example.com</Email>
        </department>
        <department>
            <DeptCode>PH</DeptCode>
            <DeptName>Physics</DeptName>
            <HOD>Robert Johnson</HOD>
            <OfficeLocation>Building H, Room 808</OfficeLocation>
            <Ph_no>555-6796</Ph_no>
            <Email>ph.dept@example.com</Email>
        </department>
        
    </departments>

    <!-- Information about courses -->
    <courses>
        <course>
            <CourseCode>CS101</CourseCode>
            <CourseName>Introduction to Computer Science</CourseName>
            <Department>Computer Science</Department>
            <Credits>4</Credits>
            <Semester>1</Semester>
            <Description>An introductory course in computer science.</Description>
            <Prerequisites>None</Prerequisites>
        </course>
        <course>
            <CourseCode>BA101</CourseCode>
            <CourseName>Principles of Management</CourseName>
            <Department>Business Administration</Department>
            <Credits>3</Credits>
            <Semester>1</Semester>
            <Description>An introductory course in management principles.</Description>
            <Prerequisites>None</Prerequisites>
        </course>
        <course>
            <CourseCode>CS101</CourseCode>
            <CourseName>Introduction to Computer Science</CourseName>
            <Department>Computer Science</Department>
            <Credits>4</Credits>
            <Semester>1</Semester>
            <Description>An introductory course in computer science.</Description>
            <Prerequisites>None</Prerequisites>
        </course>
        <course>
            <CourseCode>BA101</CourseCode>
            <CourseName>Principles of Management</CourseName>
            <Department>Business Administration</Department>
            <Credits>3</Credits>
            <Semester>1</Semester>
            <Description>An introductory course in management principles.</Description>
            <Prerequisites>None</Prerequisites>
        </course>
        <course>
            <CourseCode>MA102</CourseCode>
            <CourseName>Calculus I</CourseName>
            <Department>Mathematics</Department>
            <Credits>4</Credits>
            <Semester>1</Semester>
            <Description>An introductory course in differential and integral calculus.</Description>
            <Prerequisites>None</Prerequisites>
        </course>
        <course>
            <CourseCode>PH103</CourseCode>
            <CourseName>Physics I</CourseName>
            <Department>Physics</Department>
            <Credits>4</Credits>
            <Semester>1</Semester>
            <Description>An introductory course in classical mechanics.</Description>
            <Prerequisites>None</Prerequisites>
        </course>
        <course>
            <CourseCode>EN104</CourseCode>
            <CourseName>English Composition</CourseName>
            <Department>English</Department>
            <Credits>3</Credits>
            <Semester>1</Semester>
            <Description>An introductory course in academic writing and composition.</Description>
            <Prerequisites>None</Prerequisites>
        </course>
        <course>
            <CourseCode>CS201</CourseCode>
            <CourseName>Data Structures</CourseName>
            <Department>Computer Science</Department>
            <Credits>4</Credits>
            <Semester>3</Semester>
            <Description>A course on data structures and algorithms.</Description>
            <Prerequisites>CS101</Prerequisites>
        </course>
        <course>
            <CourseCode>EC105</CourseCode>
            <CourseName>Introduction to Economics</CourseName>
            <Department>Economics</Department>
            <Credits>3</Credits>
            <Semester>1</Semester>
            <Description>An introductory course in micro and macroeconomics.</Description>
            <Prerequisites>None</Prerequisites>
        </course>
        <course>
            <CourseCode>CH106</CourseCode>
            <CourseName>General Chemistry</CourseName>
            <Department>Chemistry</Department>
            <Credits>4</Credits>
            <Semester>1</Semester>
            <Description>An introductory course in general chemistry.</Description>
            <Prerequisites>None</Prerequisites>
        </course>        
    </courses>

    <students>
        <student>
            <StudentID>2447201</StudentID>
            <StudentName>Amal Jyothi S</StudentName>
            <DOB>2003-02-13</DOB>
            <Address>Christ, Hosur Road, Bangalore</Address>
            <Ph_no>7034231762</Ph_no>
            <Email>amalJyothi2003@gmail.com</Email>
            <Guardian>Jyothish C</Guardian>
            <Guardian_Ph_no>9947485776</Guardian_Ph_no>
            <Course>Computer Application</Course>
        </student>
        <student>
            <StudentID>2447202</StudentID>
            <StudentName>Arun MP</StudentName>
            <DOB>2001-04-10</DOB>
            <Address>Christ, Hosur Road, Bangalore</Address>
            <Ph_no>7034234566</Ph_no>
            <Email>arunmp2001@gmail.com</Email>
            <Guardian>Shoun</Guardian>
            <Guardian_Ph_no>9945362541</Guardian_Ph_no>
            <Course>Computer Science</Course>
        </student>
        <student>
            <StudentID>2447203</StudentID>
            <StudentName>Bharat Harshan</StudentName>
            <DOB>13/06/2001</DOB>
            <Address>Christ, Hosur Road, Banglore</Address>
            <Ph_no>7034231762</Ph_no>
            <Email>bharatharshan@gmail.com</Email>
            <Guardian>Harshan</Guardian>
            <Guardian_Ph_no>9947485776</Guardian_Ph_no>
            <Course>Buisness Administration</Course>
        </student>
        <student>
            <StudentID>2447204</StudentID>
            <StudentName>Shoun Chako Salaji</StudentName>
            <DOB>10/10/2003</DOB>
            <Address>Christ, Hosur Road, Banglore</Address>
            <Ph_no>8891102086</Ph_no>
            <Email>shounchakosalaji@gmail.com</Email>
            <Guardian>Salaji</Guardian>
            <Guardian_Ph_no>7654635241</Guardian_Ph_no>
            <Course>Data Engineering</Course>
        </student>
        <student>
            <StudentID>2447205</StudentID>
            <StudentName>Diya Paul</StudentName>
            <DOB>2002-08-19</DOB>
            <Address>Christ, Hosur Road, Bangalore</Address>
            <Ph_no>8901234567</Ph_no>
            <Email>diyapaul02@gmail.com</Email>
            <Guardian>Paul John</Guardian>
            <Guardian_Ph_no>9876543210</Guardian_Ph_no>
            <Course>Mathematics</Course>
        </student>
        <student>
            <StudentID>2447206</StudentID>
            <StudentName>Rohan Nair</StudentName>
            <DOB>2003-12-25</DOB>
            <Address>Christ, Hosur Road, Bangalore</Address>
            <Ph_no>8123456789</Ph_no>
            <Email>rohannair03@gmail.com</Email>
            <Guardian>Rajesh Nair</Guardian>
            <Guardian_Ph_no>9123456780</Guardian_Ph_no>
            <Course>Physics</Course>
        </student>
        <student>
            <StudentID>2447207</StudentID>
            <StudentName>Neha Sharma</StudentName>
            <DOB>2002-05-14</DOB>
            <Address>Christ, Hosur Road, Bangalore</Address>
            <Ph_no>7001234567</Ph_no>
            <Email>nehasharma02@gmail.com</Email>
            <Guardian>Anil Sharma</Guardian>